{
    "$schema": "http://json-schema.org/draft-07/schema#",
    "title": "Gantt Chart Tool schema.",
    "type": "object",
    "properties": {
        "title": {
            "type": "string",
            "description": "Title displayed in the rendered chart."
        },
        "config": {
            "type": "object",
            "properties": {
                "dateLabels": {
                    "type": "boolean",
                    "description": "Whether to show date labels in the rendered chart."
                },
                "showDeps": {
                    "type": "boolean",
                    "description": "Whether to render lines between dependent tasks."
                },
                "width": {
                    "type": "number",
                    "description": "Width (pixels) of the rendered chart."
                },
                "font": {
                    "type": "string",
                    "description": "Font family used in the rendered chart."
                },
                "googleFont": {
                    "type": "string",
                    "description": "Google font name (https://fonts.google.com) to use in the rendered chart. Note this will trigger a request to the Google Fonts service containing the name typed here."
                },
                "palette": {
                    "type": "object",
                    "properties": {
                        "gradient": {
                            "description": "Colors the chart by a gradient between two colors. The swimlanes will be colored [gradient[0], blend1, blend2, ..., blendN, gradient[1]].",
                            "type": "array",
                            "items": {
                                "type": "string",
                                "format": "color"
                            }
                        },
                        "stripes": {
                            "description": "Options for stripes in background of rendered chart.",
                            "type": "object",
                            "properties": {
                                "size": {
                                    "type": "number",
                                    "description": "Size (in pixels) of the stripes."
                                },
                                "strength": {
                                    "type": "number",
                                    "description": "Opacity (max 1.0) of the stripes."
                                }
                            }
                        },
                        "gridColor": {
                            "type": "string",
                            "format": "color",
                            "description": "Color of the x-axis grid lines in the background."
                        }
                    },
                    "required": ["gradient"]
                },
                "startDate": {
                    "type": "string",
                    "format": "date",
                    "description": "The start date to use when auto-scheduling tasks. No task will be scheduled before this date."
                }
            },
            "required": []
        },
        "swimlanes": {
            "type": "array",
            "items": {
                "type": "object",
                "properties": {
                    "id": {
                        "type": "string",
                        "description": "A unique ID for the swimlane."
                    },
                    "name": {
                        "type": "string",
                        "description": "The displayed name of the swimlane."
                    },
                    "maxParallelism": {
                        "type": "number",
                        "description": "The maximum number of tasks that can be scheduled in parallel for this swimlane."
                    },
                    "hidden": {
                        "type": "boolean",
                        "description": "Whether to show this swimlane in the rendered chart."
                    },
                    "color": {
                        "type": "string",
                        "format": "color",
                        "description": "Overrides the color for this swimlane."
                    }
                },
                "required": ["id", "name"]
            }
        },
        "tasks": {
            "type": "array",
            "items": {
                "type": "object",
                "properties": {
                    "name": {
                        "type": "string",
                        "description": "The displayed name and key for the task"
                    },
                    "swimlaneId": {
                        "type": "string",
                        "description": "The swimlane.id for the task."
                    },
                    "duration": {
                        "type": "string",
                        "format": "duration",
                        "description": "Duration for the task, if auto-scheduled."
                    },
                    "deps": {
                        "type": "array",
                        "description": "A list of task names that must be executed before this task.",
                        "items": { "type": "string" }
                    },
                    "width": {
                        "type": "number",
                        "description": "The amount of 'bandwidth' this task takes up. For example, if `swimlane.maxParallelism = 3`, and `task.width = 3`, then this task will block the entire swimlane until it finishes executing.",
                        "default": 1
                    },
                    "interval": {
                        "type": "object",
                        "description": "The start and end times for this task, if not auto-scheduled.",
                        "properties": {
                            "start": {
                                "type": "string",
                                "format": "date"
                            },
                            "end": { "type": "string", "format": "date" }
                        },
                        "required": ["start", "end"]
                    }
                },
                "anyOf": [
                    { "required": ["interval"] },
                    { "required": ["duration"] }
                ],
                "required": ["name", "swimlaneId"]
            }
        }
    },
    "required": ["title", "config", "swimlanes", "tasks"]
}