{
    "title": "Project A",
    "config": {
        "width": 800,
        "font": "Space Grotesk",
        "startDate": "2024-12-05",
        "dateLabels": true,
        "showDeps": false,
        "palette": {
            "gradient": ["#3c5ca2", "seagreen", "#eee"],
            "backgroundColor": "black",
            "stripes": { "size": 6, "strength": 0.15 },
            "outlines": { "thresholdL1": 210, "strength": 0.25 }
        },
        "padding": {
            "tasks": 5,
            "taskHeight": 15,
            "swimlanes": 5,
            "chartX": 10,
            "chartY": 5
        },
        "fontSizes": { "taskNames": 12, "taskDates": 10, "title": 22 }
    },
    "swimlanes": [
        { "id": "1", "name": "A", "maxParallelism": 3 },
        { "id": "2", "name": "B", "maxParallelism": 2 },
        { "id": "3", "name": "C", "maxParallelism": 1, "hidden": false },
        { "id": "4", "name": "D", "maxParallelism": 1 },
        { "id": "5", "name": "E", "maxParallelism": 2 }
    ],
    "tasks": [
        {
            "name": "Task 1",
            "swimlaneId": "1",
            "duration": "P24D",
            "deps": [],
            "completed": true
        },
        {
            "name": "Task 2",
            "swimlaneId": "1",
            "duration": "P2W",
            "deps": ["Task 1"]
        },
        {
            "name": "Task 3",
            "swimlaneId": "1",
            "duration": "P24D",
            "deps": ["Task 2"]
        },
        {
            "name": "Task 4",
            "swimlaneId": "2",
            "duration": "P15D",
            "deps": ["Task 3"],
            "width": 1
        },
        {
            "name": "Task 5",
            "swimlaneId": "1",
            "duration": "P20D",
            "deps": [],
            "width": 1,
            "completed": true
        },
        {
            "name": "Task 6",
            "swimlaneId": "2",
            "duration": "P2W",
            "deps": ["Task 5"],
            "width": 1
        },
        {
            "name": "Task 7",
            "swimlaneId": "3",
            "duration": "P18D",
            "deps": ["Task 6"]
        },
        {
            "name": "Task 8",
            "swimlaneId": "4",
            "duration": "P11D",
            "deps": ["Task 7"]
        },
        {
            "name": "Task 9",
            "swimlaneId": "5",
            "duration": "P17D",
            "deps": ["Task 8"]
        },
        {
            "name": "Task 10",
            "swimlaneId": "3",
            "duration": "P3W",
            "deps": []
        },
        {
            "name": "Task 11",
            "swimlaneId": "5",
            "duration": "P15D",
            "deps": []
        },
        {
            "name": "Task 12",
            "swimlaneId": "2",
            "duration": "P18D",
            "deps": ["Task 6"]
        },
        {
            "name": "Task 13",
            "swimlaneId": "1",
            "duration": "P17D",
            "deps": ["Task 6"]
        },
        {
            "name": "Task 14",
            "swimlaneId": "1",
            "duration": "P15D",
            "deps": ["Task 5"]
        },
        {
            "name": "Task 15",
            "swimlaneId": "1",
            "duration": "P2W",
            "deps": ["Task 7"],
            "width": 1
        },
        {
            "name": "Task 16",
            "swimlaneId": "3",
            "duration": "P2W",
            "deps": ["Task 7"]
        },
        {
            "name": "Fixed Task A",
            "swimlaneId": "1",
            "interval": { "start": "2024-12-07", "end": "2025-01-19" }
        },
        {
            "name": "Fixed Task B",
            "swimlaneId": "2",
            "interval": { "start": "2024-12-18", "end": "2025-01-06" }
        }
    ]
}