{
    "title": "Project A",
    "config": {
        "width": 700,
        "googleFont": "Space Grotesk",
        "startDate": "2024-11-10",
        "palette": {
            "gradient": ["#293936", "#9c9c9c"],
            "backgroundColor": "#222",
            "stripes": { "size": 6 },
            "outlines": { "thresholdL1": 300, "strength": 0.25 }
        },
        "fontSizes": { "title": 34 }
    },
    "swimlanes": [
        { "id": "1", "name": "A", "maxParallelism": 2 },
        { "id": "2", "name": "B", "maxParallelism": 2 },
        { "id": "3", "name": "C", "maxParallelism": 1, "hidden": false },
        { "id": "4", "name": "D", "maxParallelism": 1 },
        { "id": "5", "name": "E", "maxParallelism": 2 }
    ],
    "tasks": [
        {
            "name": "Task 1",
            "swimlaneId": "1",
            "duration": "PT13D",
            "deps": []
        },
        {
            "name": "Task 2",
            "swimlaneId": "2",
            "duration": "PT19D",
            "deps": ["Task 1"],
            "width": 1
        },
        {
            "name": "Task 3",
            "swimlaneId": "3",
            "duration": "PT23D",
            "deps": ["Task 2"]
        },
        {
            "name": "Task 4",
            "swimlaneId": "4",
            "duration": "PT16D",
            "deps": ["Task 3"],
            "width": 1
        },
        {
            "name": "Task 5",
            "swimlaneId": "5",
            "duration": "PT10D",
            "deps": ["Task 4"]
        },
        {
            "name": "Task 6",
            "swimlaneId": "2",
            "duration": "PT22D",
            "deps": ["Task 4", "Task 3"]
        },
        {
            "name": "Task 7",
            "swimlaneId": "4",
            "duration": "PT22D",
            "deps": ["Task 4"],
            "width": 1
        },
        {
            "name": "Task 8",
            "swimlaneId": "1",
            "duration": "PT19D",
            "deps": []
        },
        {
            "name": "Task 9",
            "swimlaneId": "2",
            "duration": "PT11D",
            "deps": ["Task 8"],
            "width": 1
        },
        {
            "name": "Task 10",
            "swimlaneId": "5",
            "duration": "PT16D",
            "deps": ["Task 9"]
        },
        {
            "name": "Task 11",
            "swimlaneId": "1",
            "duration": "PT20D",
            "deps": ["Task 10"]
        },
        {
            "name": "Task 12",
            "swimlaneId": "1",
            "duration": "PT24D",
            "deps": ["Task 10"],
            "width": 1
        },
        {
            "name": "Task 13",
            "swimlaneId": "1",
            "duration": "PT14D",
            "deps": ["Task 11"]
        },
        {
            "name": "Task 14",
            "swimlaneId": "2",
            "duration": "PT12D",
            "deps": ["Task 11"],
            "width": 1
        },
        {
            "name": "Fixed Task A",
            "swimlaneId": "1",
            "interval": { "start": "2025-01-13", "end": "2025-01-29" }
        },
        {
            "name": "Fixed Task B",
            "swimlaneId": "2",
            "interval": { "start": "2025-02-08", "end": "2025-02-12" }
        }
    ]
}